attrs :
{
    bcdUSB = 0x200;
    bDeviceClass = 0xEF;
    bDeviceSubClass = 0x02;
    bDeviceProtocol = 0x01;
    bMaxPacketSize0 = 0x40;
    idVendor = 0x25ED;
    idProduct = 0x0202;
    bcdDevice = 0x100;
};
os_descs :
{
    config_id = 1;
    use = 1;
    qw_sign = "MSFT100";
    b_vendor_code = 0xcd;
};
strings = (
    {
        lang = 0x409;
        manufacturer = "Beacon EmbeddedWorks";
        product = "@@PRODUCT_NAME@@";
        serialnumber = "00000000";
    } );
functions :
{
    rndis_usb0 :
    {
        instance = "usb0";
        type = "rndis";
        attrs :
        {
            dev_addr = "00:14:2d:ff:ff:ff";
            host_addr = "00:14:2d:ff:ff:fe";
            qmult = 5;
        };
        os_descs = (
            {
                interface = "rndis";
                compatible_id = "RNDIS";
                sub_compatible_id = "5162001";
            } );
    };
};
configs = (
    {
        id = 1;
        name = "c";
        attrs :
        {
            bmAttributes = 0xC0;
            bMaxPower = 0x1;
        };
        strings = (
            {
                lang = 0x409;
                configuration = "RNDIS";
            } );
        functions = (
            {
                name = "rndis.usb0";
                function = "rndis_usb0";
            } );
    } );
